<?xml version="1.0"?>
<Page xmlns:xsi="http://www.w3.org/2001/XMLSchema-instance"
      xsi:noNamespaceSchemaLocation="../../View.xsd"
      layout="frame"
      background="#F9F9F9">

      <include src="page.js"/>

      <View layout="vertical">

        <View id="view_sort_container" height="wrap"/>

        <View layout="frame">

            <View clipToBounds="true">
              <ScrollView id="sv" layout="vertical"/>
            </View>

            <View id="view_top_sheet_container" />
        </View>


      </View>



</Page>
